{
  "contract_version": "risk-contract.v0.1-draft",
  "schema_status": "DRAFT",
  "risk_request_id": "risk-request-allow",
  "stage": "PLAN_REVIEW",
  "requested_at": "2026-10-10T09:00:00+08:00",
  "upstream": {
    "contract_version": "investment-agent.v1",
    "request_id": "req-demo-20261007-001",
    "operation": "PORTFOLIO_HEALTH_CHECK",
    "task_state": {
      "task_id": "task-4bba1586-f582-4899-bc8c-0e27f6ddff72",
      "session_id": "session-f4229044-5c8d-4228-8fc9-8599688bef40",
      "intent": "PORTFOLIO_HEALTH_CHECK",
      "stage": "RISK_CHECK",
      "status": "HANDOFF_REQUIRED",
      "risk_profile": {
        "investment_horizon_days": 365,
        "max_drawdown": 0.1,
        "liquidity_need": "medium"
      },
      "missing_fields": [],
      "portfolio_snapshot_id": "snapshot-de37f3dab3586cd6",
      "risk_profile_id": "risk-profile-79038e85-0b8e-45aa-9be6-0b9b2fc53bed",
      "tool_result_refs": [
        "trace-47a06c109ce838e8",
        "trace-806989342cd10329",
        "trace-b859fe1a05c6b119",
        "trace-1f704db52146f8f1"
      ],
      "proposed_action_ids": [
        "proposal-a-74ef228729",
        "proposal-b-53a1666dd2",
        "proposal-c-45eb627fc2"
      ],
      "risk_decision_id": null,
      "approval_id": null,
      "error_state": null,
      "checkpoint": {
        "stage": "RISK_CHECK",
        "completed": [
          "VALIDATE_INPUT",
          "DIAGNOSE",
          "GENERATE_CANDIDATES",
          "SIMULATE"
        ],
        "result_refs": {
          "VALIDATE_INPUT": "trace-47a06c109ce838e8",
          "DIAGNOSE": "trace-806989342cd10329",
          "GENERATE_CANDIDATES": "trace-b859fe1a05c6b119",
          "SIMULATE": "trace-1f704db52146f8f1"
        },
        "resume_token": "resume-5bc5e178-3ea6-4a6d-a390-bd086204b90c",
        "last_tool_result_ref": "trace-1f704db52146f8f1"
      },
      "handoff": {
        "owner": "Safety/Risk/Eval",
        "reason": "Risk decision is outside Agent Core and Tools ownership."
      }
    },
    "artifacts": {
      "portfolio_snapshot": {
        "snapshot_id": "snapshot-de37f3dab3586cd6",
        "portfolio_id": "golden-demo-portfolio",
        "as_of": "2026-09-23T08:00:00Z",
        "positions": [
          {
            "instrument_id": "EQUITY_ALPHA",
            "name": "Alpha Holdings",
            "type": "A_SHARE",
            "sector": "Technology",
            "quantity": 100,
            "price": 47.2,
            "market_value": 4720,
            "weight": 0.15186615
          },
          {
            "instrument_id": "ETF_GROWTH",
            "name": "Growth ETF",
            "type": "ETF",
            "sector": "Technology",
            "quantity": 100,
            "price": 75.5,
            "market_value": 7550,
            "weight": 0.24292149
          },
          {
            "instrument_id": "ETF_CONSUMER",
            "name": "Consumer ETF",
            "type": "ETF",
            "sector": "Consumer",
            "quantity": 100,
            "price": 47.6,
            "market_value": 4760,
            "weight": 0.15315315
          },
          {
            "instrument_id": "ETF_BOND",
            "name": "Bond ETF",
            "type": "ETF",
            "sector": "Fixed Income",
            "quantity": 100,
            "price": 40.5,
            "market_value": 4050,
            "weight": 0.13030888
          }
        ],
        "cash": 10000,
        "cash_weight": 0.32175032,
        "total_value": 31080,
        "data_quality": {
          "status": "VALID",
          "errors": [],
          "warnings": []
        }
      },
      "health_report": {
        "report_id": "health-45f227c09db8cce7",
        "snapshot_id": "snapshot-de37f3dab3586cd6",
        "metrics": {
          "cumulative_return": -0.02789133,
          "annualized_return": -0.69519485,
          "annualized_volatility": 0.15334647,
          "max_drawdown": -0.02789133,
          "sharpe_ratio": -7.79583962,
          "ending_index": 0.97210867
        },
        "cash_weight": 0.32175032,
        "concentration": {
          "hhi": 0.22603374,
          "hhi_basis": "all assets including cash; top-N excludes cash",
          "top_1": 0.24292149,
          "top_3": 0.54794079,
          "largest_instrument": "ETF_GROWTH"
        },
        "correlation_matrix": {
          "EQUITY_ALPHA": {
            "EQUITY_ALPHA": 1,
            "ETF_GROWTH": 0.988122,
            "ETF_CONSUMER": 0.938165,
            "ETF_BOND": -0.825061
          },
          "ETF_GROWTH": {
            "EQUITY_ALPHA": 0.988122,
            "ETF_GROWTH": 1,
            "ETF_CONSUMER": 0.97728,
            "ETF_BOND": -0.815422
          },
          "ETF_CONSUMER": {
            "EQUITY_ALPHA": 0.938165,
            "ETF_GROWTH": 0.97728,
            "ETF_CONSUMER": 1,
            "ETF_BOND": -0.819951
          },
          "ETF_BOND": {
            "EQUITY_ALPHA": -0.825061,
            "ETF_GROWTH": -0.815422,
            "ETF_CONSUMER": -0.819951,
            "ETF_BOND": 1
          }
        },
        "hidden_clusters": [
          {
            "instruments": [
              "EQUITY_ALPHA",
              "ETF_GROWTH"
            ],
            "correlation": 0.988122
          },
          {
            "instruments": [
              "EQUITY_ALPHA",
              "ETF_CONSUMER"
            ],
            "correlation": 0.938165
          },
          {
            "instruments": [
              "ETF_GROWTH",
              "ETF_CONSUMER"
            ],
            "correlation": 0.97728
          }
        ],
        "attention_points": [
          "largest position exceeds 20%",
          "multiple instruments move together in the fixed window"
        ],
        "data_window": {
          "start": "2026-09-15",
          "end": "2026-09-23",
          "observations": 7,
          "annualization_factor": 252
        }
      },
      "candidates": [
        {
          "proposal_id": "proposal-a-74ef228729",
          "plan_id": "A",
          "label": "Keep / minimum action",
          "objective": "preserve the current allocation and avoid unnecessary turnover",
          "target_weights": {
            "CASH": 0.32175033,
            "EQUITY_ALPHA": 0.15186615,
            "ETF_GROWTH": 0.24292149,
            "ETF_CONSUMER": 0.15315315,
            "ETF_BOND": 0.13030888
          },
          "actions": [
            {
              "instrument_id": "CASH",
              "from_weight": 0.32175033,
              "to_weight": 0.32175033,
              "delta_weight": 0,
              "side": "HOLD"
            },
            {
              "instrument_id": "EQUITY_ALPHA",
              "from_weight": 0.15186615,
              "to_weight": 0.15186615,
              "delta_weight": 0,
              "side": "HOLD"
            },
            {
              "instrument_id": "ETF_BOND",
              "from_weight": 0.13030888,
              "to_weight": 0.13030888,
              "delta_weight": 0,
              "side": "HOLD"
            },
            {
              "instrument_id": "ETF_CONSUMER",
              "from_weight": 0.15315315,
              "to_weight": 0.15315315,
              "delta_weight": 0,
              "side": "HOLD"
            },
            {
              "instrument_id": "ETF_GROWTH",
              "from_weight": 0.24292149,
              "to_weight": 0.24292149,
              "delta_weight": 0,
              "side": "HOLD"
            }
          ],
          "constraints": {
            "max_single_asset_weight": 0.35,
            "max_turnover": 0.05,
            "objective": "minimum_action"
          },
          "turnover": 0,
          "rationale": [
            "No hard constraint is currently violated; keep the baseline for comparison."
          ],
          "expected_metrics": {
            "max_single_asset_weight": 0.24292149,
            "cash_weight": 0.32175033
          },
          "proposal_hash": "b1c4acfbd501a4221e0e7e766b395102138a5ad99315c7cbcd06e33f243a7b74",
          "validation": {
            "valid": true,
            "errors": []
          }
        },
        {
          "proposal_id": "proposal-b-53a1666dd2",
          "plan_id": "B",
          "label": "Moderate rebalance",
          "objective": "reduce the largest position with bounded turnover",
          "target_weights": {
            "CASH": 0.36467182,
            "EQUITY_ALPHA": 0.15186615,
            "ETF_GROWTH": 0.2,
            "ETF_CONSUMER": 0.15315315,
            "ETF_BOND": 0.13030888
          },
          "actions": [
            {
              "instrument_id": "CASH",
              "from_weight": 0.32175033,
              "to_weight": 0.36467182,
              "delta_weight": 0.04292149,
              "side": "BUY_OR_HOLD_CASH"
            },
            {
              "instrument_id": "EQUITY_ALPHA",
              "from_weight": 0.15186615,
              "to_weight": 0.15186615,
              "delta_weight": 0,
              "side": "HOLD"
            },
            {
              "instrument_id": "ETF_BOND",
              "from_weight": 0.13030888,
              "to_weight": 0.13030888,
              "delta_weight": 0,
              "side": "HOLD"
            },
            {
              "instrument_id": "ETF_CONSUMER",
              "from_weight": 0.15315315,
              "to_weight": 0.15315315,
              "delta_weight": 0,
              "side": "HOLD"
            },
            {
              "instrument_id": "ETF_GROWTH",
              "from_weight": 0.24292149,
              "to_weight": 0.2,
              "delta_weight": -0.04292149,
              "side": "SELL_OR_REDUCE"
            }
          ],
          "constraints": {
            "max_single_asset_weight": 0.2,
            "max_turnover": 0.1,
            "objective": "concentration_control"
          },
          "turnover": 0.04292149,
          "rationale": [